Ticker,最新价,公司主营,市值,1日涨幅,5日涨幅,20日涨幅,连涨天数,成交量倍数,20日平均成交额,距离52周高点,信号
ICCM,9.3,"IceCure Medical Ltd, a commercial-stage medical device company, engages in the research, development, and marketing of cryoablation systems, disposables, and technologies for treating tumors in the United States, Japan,...",26102320.0,0.5196079027189848,3.366197038057871,0.3656388060025466,3,1.4622060298742448,58237319.83228614,-0.7394957985438115,5日涨幅>20% / 20日新高
CAST,8.58,"FreeCast, Inc. develops and markets an interactive digital media guide that facilitates access to a virtual library of entertainment media in the United States. The company offers SmartGuide and Select TV, which utilizes...",354712768.0,0.038740882077134886,1.287999979654948,8.976743931380916,1,0.11036097249921786,104395897.72049814,-0.1280488017625142,5日涨幅>20%
QURE,48.85,"uniQure N.V. develops treatments for patients suffering from rare and other devastating diseases in the United States. The company offers HEMGENIX that allows people living with hemophilia B to produce factor IX, which c...",3080846592.0,-0.0038744379661316275,0.8099295623705483,0.9423458932432307,0,1.7538385830454941,104594415.10237694,-0.307975619657316,5日涨幅>20%
DFTX,42.13,"Definium Therapeutics, Inc., a clinical biopharmaceutical company, develops novel product candidates to treat brain health disorders. The company's lead product candidates DT120, which is in phase 3 for the treatment of...",4594983936.0,0.16445551997655095,0.7437914459518498,0.8413462680696906,1,3.7464643380832423,95407884.85471725,0.0,5日涨幅>20% / 放量大涨 / 20日新高
APGE,132.69,"Apogee Therapeutics, Inc., a clinical stage biotechnology company, develops novel biologics for the treatment of atopic dermatitis, asthma, eosinophilic esophagitis, chronic obstructive pulmonary disease, and other infla...",9976126464.0,-0.0014298798496720222,0.5566636058986212,0.6023427889551498,0,1.3664570427676621,579356562.0401382,-0.0014298798496720222,5日涨幅>20%
HQ,28.41,Horizon Quantum Holdings Ltd. develops programming tools and software that simplify and automate the process of developing applications for quantum computers. The company provides programming tools that enable developers...,1465334784.0,-0.1491464400499578,0.519251266754833,1.3994931994323059,0,0.6347652010676679,33703690.75229168,-0.25996352437888703,5日涨幅>20%
BLZE,11.97,"Backblaze, Inc., a cloud storage platform, provides businesses and consumers cloud services to store, use, and protect data in the United States, the United Kingdom, Canada, and internationally. The company offers cloud...",718376384.0,0.026586657261878255,0.4439083621362534,0.5405405786888402,2,4.073478322270866,32155676.245765686,0.0,5日涨幅>20% / 20日新高
ABSI,10.075,"Absci Corporation, a clinical-stage biopharmaceutical company, develops various antibody therapeutics in the United States. Its preclinical development programs include ABS-101, which is in Phase 1 clinical trial for the...",1570743424.0,0.35964912506492963,0.43928568703787674,0.908143827447089,1,6.8079341614396105,38301886.216135025,0.0,5日涨幅>20% / 放量大涨 / 20日新高
RGNX,9.97,"REGENXBIO Inc., a clinical-stage biotechnology company, provides gene therapies that deliver functional genes to cells with genetic defects in the United States. Its gene therapy product candidates are based on NAV Techn...",515425280.0,0.0020100962961877578,0.4386725128417479,0.580031752367504,3,1.099740687562127,15877037.425665855,-0.37609508431603167,5日涨幅>20% / 20日新高
ARQQ,28.64,"Arqit Quantum Inc. provides cybersecurity services through satellite and terrestrial platforms in the United Kingdom. The company offers QuantumCloud, a platform as a service that creates unbreakable software encryption...",498405056.0,-0.013774156792985215,0.4363088577019434,0.7263411167106504,0,1.1875762430581998,28299597.621088028,-0.5084949516963226,5日涨幅>20%
JBIO,21.9,"Jade Biosciences, Inc. operates as a biotechnology company that develops therapies for inflammation and immunology indications in patients living with autoimmune diseases. It develops JADE101, a monoclonal antibody to bl...",1332831232.0,-0.0031861491584876944,0.4101738567345343,0.00875175228328362,0,0.8745424531219984,26895737.97820568,-0.18435756769506972,5日涨幅>20%
BFLY,7.77,"Butterfly Network, Inc. develops, manufactures, and commercializes ultrasound imaging solutions in the United States and internationally. The company offers Butterfly iQ+ and iQ3 ultrasound devices that can perform whole...",2032949888.0,0.013037797084467284,0.3752212123495926,0.7114537546725315,2,1.069087638071301,64802981.81275606,-0.12696625685815088,5日涨幅>20%
BRBR,11.91,"BellRing Brands, Inc., together with its subsidiaries, provides various nutrition products in the United States. The company offers ready-to-drink (RTD) protein shakes, other RTD beverages, protein powders, nutrition bar...",1384869120.0,0.056787876100533374,0.34881086640070347,0.3848836417582471,5,1.4410910175986351,54120192.14806318,-0.7973800596333633,连续5天上涨 / 5日涨幅>20% / 20日新高
CLPT,17.98,"ClearPoint Neuro, Inc., a commercial-stage medical device company, focuses on the development and commercialization of platforms for performing minimally invasive surgical procedures in the brain in the United States. Th...",539212352.0,-0.029681658069530603,0.3478260372244675,0.5211505927626607,0,0.636633878271851,15555342.245883942,-0.39256759086083604,5日涨幅>20%
BWIN,24.87,"The Baldwin Insurance Group, Inc. operates as an independent insurance distribution firm that delivers insurance and risk management solutions in the United States. The company operates through three segments: Insurance...",2424575232.0,0.019680256728037637,0.330658112818903,0.3082588395474337,4,1.427489349861836,42077835.41741371,-0.42149337361644024,5日涨幅>20% / 20日新高
SLDB,9.25,"Solid Biosciences Inc. develops therapies for neuromuscular and cardiac diseases in the United States. The company's lead product candidate is SGT-003, which is in phase 1/2 for the treatment of Duchenne muscular dystrop...",910658880.0,0.05233220024383245,0.3083450884593608,0.34447672182221645,2,1.6557847721892456,16455749.23195362,0.0,5日涨幅>20% / 20日新高
CGEM,17.65,"Cullinan Therapeutics, Inc., a clinical-stage biopharmaceutical company, develops therapies for autoimmune diseases and cancer in the United States. It engages in the development of CLN-978, a CD19xCD3 bispecific T cell...",1084734464.0,-0.005633824308153623,0.3025829793418662,0.1416558586662069,0,1.0081096847436906,21091490.33536911,-0.005633824308153623,5日涨幅>20%
UMC,28.01,,,0.06908394707005772,0.2955596272712733,0.32874764375034315,1,1.1926180564777915,442902515.54302216,0.0,5日涨幅>20% / 20日新高
MANE,117.29,,,0.13214288265482899,0.2896097289841002,0.14429269185880345,5,1.9640962194119924,51812906.1240387,0.0,连续5天上涨 / 5日涨幅>20% / 20日新高
REPL,11.27,"Replimune Group, Inc., a clinical-stage biotechnology company, focuses on the development and commercialization of oncolytic immunotherapies to treat cancer. The company's proprietary oncolytic immunotherapy product cand...",930593408.0,-0.013134817646949792,0.2835991800138533,1.450000150307368,0,0.44612319009411944,56252897.991194725,-0.10768009852369254,5日涨幅>20%
VKTX,37.87,"Viking Therapeutics, Inc., a clinical-stage biopharmaceutical company, focuses on the development of novel therapies for metabolic and endocrine disorders. Its lead drug candidate is VK2809, an orally available tissue an...",4396920320.0,0.08790570059964486,0.27723438175753845,0.22954545032316553,9,2.372839064643244,70343152.58348465,-0.10026137337620467,连续5天上涨 / 5日涨幅>20% / 20日新高
AVTX,18.16,"Avalo Therapeutics, Inc., a clinical stage biotechnology company, develops IL-1ß-based treatments for immune-mediated inflammatory diseases in the Unites States. Its lead product includes AVTX-009, a humanized monoclonal...",954590784.0,0.018508128161419668,0.2672714545776167,0.13358297930705376,3,0.7628859070353622,24999796.7031765,-0.20594669081696315,5日涨幅>20% / 20日新高
NUVB,6.46,,,0.06953643691168043,0.2617187856521932,0.37739871201099917,5,2.0992008642917206,22653101.505975723,-0.3228511463335271,连续5天上涨 / 5日涨幅>20% / 20日新高
EWTX,42.3,"Edgewise Therapeutics, Inc., a biopharmaceutical company, discovers, develops, and commercializes therapies for the treatment of muscle disorders. Its lead product candidate, sevasemten, an orally administered small mole...",4551184384.0,0.08936382287859423,0.24594987589031603,0.2604290079298186,2,0.7034184442611843,67912099.31638718,0.0,5日涨幅>20% / 20日新高
LILAK,6.55,"Liberty Latin America Ltd., together with its subsidiaries, provides fixed, mobile, and subsea telecommunications services in Puerto Rico, Panama, Costa Rica, Jamaica, Latin America and the Caribbean, the Bahamas, Trinid...",1319170048.0,0.11394558898875973,0.23768928438204484,0.18301839505928297,3,1.437596300656856,10064020.078642797,0.0,5日涨幅>20% / 20日新高
BHVN,14.96,"Biohaven Ltd., a biopharmaceutical company, focuses on the discovery, development, and commercialization of treatments for immunology, neuroscience, and oncology therapeutic areas worldwide. It develops BHV-1300, which i...",2252392448.0,0.012178640624345594,0.23738625718253226,0.48560084324889474,1,0.4687849458936582,45223454.55800533,-0.17393707708679307,5日涨幅>20%
TDUP,6.54,"ThredUp Inc., together with its subsidiaries, operates an online resale platform in the United States. The company's platform enables consumers to buy and sell primarily secondhand apparel, shoes, and accessories. ThredU...",843927168.0,0.05314008400626746,0.2362948977342032,0.49999994531684133,2,0.8148547696954442,10045769.985773563,-0.4586092712617664,5日涨幅>20% / 20日新高
NEO,12.9,"NeoGenomics, Inc. operates a network of cancer-focused testing laboratories in the United States and the United Kingdom. The company offers testing services to hospitals, academic centers, pathologists, oncologists, clin...",1679731840.0,0.12467300071579612,0.22974260247817146,0.3915856506486426,4,2.184355108509852,29441373.445034027,-0.02420579743077833,5日涨幅>20% / 放量大涨 / 20日新高
EVC,11.21,,,0.034132830290666494,0.22647698217390788,0.28812834756704553,5,0.7272726855348366,20265550.304107666,0.0,连续5天上涨 / 5日涨幅>20% / 20日新高
RCUS,28.8,,,0.02200138130484297,0.2229299435279002,0.1935350285418569,5,1.273173671915402,34722585.48171997,0.0,连续5天上涨 / 5日涨幅>20% / 20日新高
SLS,9.17,"SELLAS Life Sciences Group, Inc., a late-stage clinical biopharmaceutical company, focuses on the development of novel therapeutics for various cancer indications in the United States. The company's lead product candidat...",1803120768.0,0.011025400753518433,0.21779546092832525,0.12931037013956415,5,0.5327998922643563,71385184.92321253,-0.015037630183964867,连续5天上涨 / 5日涨幅>20%
GENB,16.23,"Generate Biomedicines, Inc., engaged in the field of generative biology by using machine learning for drug discovery and development through the programming of novel protein therapeutics in the United States. It uses pro...",2080563840.0,0.05184700072832782,0.21391171885994753,0.21664163092890165,1,0.700398890226666,13094378.971619606,0.0,5日涨幅>20% / 20日新高
ORKA,82.09,"Oruka Therapeutics, Inc., a clinical-stage biopharmaceutical company, focuses on developing novel monoclonal antibody therapeutics for psoriasis (PsO), and other inflammatory and immunology (I&I) indications. Its lead pr...",4951020032.0,-0.015707495971469365,0.21237627304466478,0.3899423370994801,0,0.9801547918687099,90515904.70842361,-0.03853362639216573,5日涨幅>20%
OLMA,11.14,"Olema Pharmaceuticals, Inc., a clinical-stage biopharmaceutical company, focuses on the discovery, development, and commercialization of therapies for women's cancers. The company's lead product candidate is palazestrant...",973050880.0,0.05792978402853599,0.2121872526634132,-0.17785976483306654,5,1.383016491576405,17866512.617173195,-0.6890873632703123,连续5天上涨 / 5日涨幅>20%
MBX,48.4,"MBX Biosciences, Inc., a clinical-stage biopharmaceutical company, focuses on the discovery and development of precision peptide therapies for the treatment of endocrine and metabolic disorders. Its lead product candidat...",2303720704.0,0.043328350133132076,0.20728364533953703,0.5244094968780757,7,1.1140128840317183,29919110.488119125,0.0,连续5天上涨 / 5日涨幅>20% / 20日新高
PRAX,308.94,"Praxis Precision Medicines, Inc., a clinical-stage biopharmaceutical company, engages in the development of therapies for central nervous system (CNS) disorders characterized by neuronal excitation-inhibition imbalance i...",8612868096.0,0.011690760000335754,0.20093295409681722,-0.11882488002527059,5,0.9811606155789917,158565686.10153198,-0.13493686271815541,连续5天上涨 / 5日涨幅>20%
RYTM,107.55,"Rhythm Pharmaceuticals, Inc., a commercial-stage biopharmaceutical company, focuses on the rare neuroendocrine diseases in the United States and internationally. The company's lead product candidate is IMCIVREE (setmelan...",7377239552.0,0.012807237772708202,0.19872939799894218,0.19739482762384442,9,1.4984635685529442,75587696.34983063,-0.08561468678521045,连续5天上涨 / 20日新高
ZBIO,21.8,"Zenas BioPharma, Inc., a clinical-stage biopharma company, engages in the development and commercialization of transformative immunology-based therapies. Its lead product candidate is obexelimab, a bifunctional monoclona...",1376307584.0,0.07894082253784696,0.1984606155587425,0.1639081564258098,1,1.1961812544198445,12076953.440523148,-0.49501968585343714,20日新高
RLAY,18.02,"Relay Therapeutics, Inc. operates as a clinical-stage precision medicines company. It transforms the drug discovery process with a focus on enhancing small molecule therapeutic discovery in targeted oncology and genetic...",3927284992.0,0.033256875340881065,0.19734220793280866,0.27170080174598454,9,1.1016241338886845,61869708.370690346,0.0,连续5天上涨 / 20日新高
LZB,41.85,,,0.03846152025817262,0.1936679074406069,0.12990085235438964,3,1.1472204138137465,25635289.963493347,0.0,20日新高
CLYM,12.75,"Climb Bio, Inc., a clinical-stage biotechnology company, focuses on developing therapies to address unmet needs for patients living with immune-mediated diseases. The company's lead product candidate is the budoprutug, a...",730103552.0,0.03658534977943373,0.19047618623594187,0.11940295133305501,5,1.2069315293564076,14616096.39345169,0.0,连续5天上涨 / 20日新高
IDYA,36.28,"IDEAYA Biosciences, Inc., a precision medicine oncology company, develops targeted therapeutics for patient populations selected using molecular diagnostics in the United States. The company offers Darovasertib, an oral,...",3492849664.0,0.03924373926877367,0.18678440109501904,0.23611578561349655,3,1.6170252750429874,39517732.96831131,-0.04173274710995878,20日新高
TSHA,6.94,"Taysha Gene Therapies, Inc., a clinical-stage biotechnology company, focuses on developing and commercializing adeno-associated virus-based gene therapies for the treatment of severe monogenic diseases of the central ner...",1994285568.0,0.0116617962316381,0.18632481544567692,0.24150265971058804,5,0.7729451367335279,15267993.919069767,-0.005730653544946063,连续5天上涨 / 20日新高
DNA,9.73,,,0.09819412181392306,0.18514001181812723,0.11967779195302963,1,0.9245173678049459,11373037.054460049,-0.3971499436067657,20日新高
SION,41.09,"Sionna Therapeutics, Inc., a clinical-stage biopharmaceutical company, researches and develops medicines for the treatment of cystic fibrosis (CF). It develops galicaftor (SION-2222), a transmembrane domain 1 (TMD1)-dire...",1855227008.0,0.03059947964351384,0.18244604755648597,-0.04174442329616346,5,1.3746026134713718,14974180.983181,-0.10576714972051426,连续5天上涨
NTRA,259.97,"Natera, Inc., a diagnostics company, engages in the development and commercialization of molecular testing services worldwide. It offers Signatera, a personalized ctDNA blood test for MRD assessment, early recurrence mon...",37231702016.0,0.10738629793728793,0.18109127481632914,0.2939624532480767,2,2.046086523632642,315642037.0719147,0.0,放量大涨 / 20日新高
PVLA,129.84,"Palvella Therapeutics, Inc., a clinical-stage biopharmaceutical company, focuses on developing and commercializing novel therapies to treat patients serious and rare genetic skin diseases. The company's lead product cand...",1862274816.0,0.09403434448953352,0.1790773074778249,0.10417552837402999,1,1.0760737822892206,29353503.622817993,-0.12471349910148632,20日新高
GLUE,20.85,"Monte Rosa Therapeutics, Inc., a clinical-stage biotechnology company, engages in the development of novel small molecule precision medicines that employ the body's natural mechanisms to selectively degrade therapeutical...",1761395840.0,0.006760082239792853,0.17398649283589762,0.08593747671693652,3,1.9697478630643013,21253583.741750717,-0.17621490235407222,20日新高
EPC,26.58,,,0.013730000754355709,0.17350995017062143,0.5281809168729106,2,1.1513864090413366,22258942.517671585,0.0,20日新高
VERA,39.51,"Vera Therapeutics, Inc., a clinical stage biotechnology company, focuses on the development and commercialization of transformative treatments for patients with immunological diseases. The company offers atacicept, a ful...",2836142336.0,0.03429312912120852,0.1734481874125633,0.1505532366328688,1,1.999148843299869,42381140.62547684,-0.2902820258475727,20日新高
HOV,141.91,,,0.11310695772187906,0.17242236110975417,0.27869885898001634,2,1.5765403057993306,13025180.840530396,-0.0912525593354454,20日新高
NAT,6.47,,,0.0015479492237815418,0.17210141531661427,0.2662473021756453,6,1.5917473573679464,24431154.05368805,0.0,连续5天上涨 / 20日新高
RARE,29.11,"Ultragenyx Pharmaceutical Inc., a biopharmaceutical company, focuses on the identification, acquisition, development, and commercialization of novel products for the treatment of rare and ultra-rare genetic diseases in N...",2867021312.0,0.012169693278313742,0.17142857800752598,0.25799487373252816,1,0.8670929634519435,46417612.43037224,-0.2975385720309959,20日新高
BCAX,25.64,"Bicara Therapeutics Inc., a clinical-stage biopharmaceutical company, engages in the development of bifunctional therapies for solid tumors. Its lead program is ficerafusp alfa, a bifunctional antibody that combines a cl...",1684647040.0,0.025599975585937518,0.16810927100008155,0.16651501017455095,6,1.404336534894266,13252864.668245316,0.0,连续5天上涨 / 20日新高
CDNA,27.13,"CareDx, Inc. provides solutions for improving outcomes for transplant patients and advancing organ health in the United States and internationally. The company provides AlloSure Kidney, a donor-derived cell-free DNA (dd-...",1401521664.0,0.08001585407568568,0.1668816843340475,0.25951708484885194,2,1.4690089358245328,20347725.212898254,0.0,20日新高
CADL,9.27,"Candel Therapeutics, Inc., a clinical stage biopharmaceutical company, develops immunotherapies for cancer patients. It develops CAN-2409, which is in Phase 2a clinical trials for the treatment of prostate cancer; and Ph...",679215168.0,0.020925169124898835,0.16311175681232504,0.16603782140474665,1,0.6527168471385799,17345832.136847973,0.0,20日新高
NWL,5.51,"Newell Brands Inc. engages in the design, manufacture, sourcing, and distribution of consumer and commercial products worldwide. The company operates in three segments: Home and Commercial Solutions, Learning and Develop...",2341352192.0,0.07617194375780101,0.16244736180272623,0.5611667191094818,3,0.9712691334035223,47683340.88188648,-0.08907698800987662,20日新高
WEN,7.86,"The Wendy's Company, together with its subsidiaries, engages in the operation, development, and franchising of a system of quick-service restaurants in the United States and internationally. The company operates through...",1497177856.0,0.25559102973361414,0.16100445430706167,0.08771134618178933,2,22.9918760289574,61192557.360544205,-0.2926890817890905,放量大涨 / 20日新高
CDNL,81.94,"Cardinal Infrastructure Group Inc., a civil contracting company, provides site development and infrastructure services to the residential, commercial, industrial, municipal, and state infrastructure markets in the southe...",1253361152.0,0.1266327328389245,0.15996606949877346,0.5595736774566789,1,1.480032038147748,34405330.463256836,0.0,20日新高
GSHD,43.4,"Goosehead Insurance, Inc. operates as a holding company for Goosehead Financial, LLC that engages in the provision of personal lines insurance agency services in the United States. The company offers insurance service fo...",1545302912.0,0.08337493854442934,0.15887852180840478,0.08500003814697266,4,0.9349811173770936,21744137.340602875,-0.5886645754225037,20日新高
PRCH,13.15,"Porch Group, Inc. develops and sells software and data solutions, manages insurance services, and provides consumer services related to homeownership in the United States. It operates through four segments: Insurance Ser...",1438652928.0,0.019379845534327478,0.15350877706657462,0.28795294509292524,2,1.5672561839993506,17373328.988809586,-0.3093487927405353,20日新高
PTCT,84.41,"PTC Therapeutics, Inc., a biopharmaceutical company, focuses on the discovery, development, and commercialization of medicines to children and adults living with rare disorders in the United States and internationally. T...",7001753600.0,0.027760945877744136,0.1520405012888335,0.24774577617443327,5,1.7350673034717723,143263349.8977661,-0.02133329087409419,连续5天上涨 / 20日新高
DNTH,90.8,"Dianthus Therapeutics, Inc., a clinical-stage biotechnology company, engages in the development of therapies for patients with severe autoimmune diseases. Its lead clinical-stage candidate, claseprubart, a monoclonal ant...",4963694080.0,0.03735866923414588,0.15111569743143383,0.045842010722454196,5,1.3172026012130236,93996772.13172913,-0.05179614634319285,连续5天上涨
PRAA,18.0,"PRA Group, Inc., a financial services company, engages in the purchase, collection, and management of nonperforming loan portfolios in the United States, Europe, the United Kingdom, South America, Canada, and Australia....",686536000.0,0.022727250560256484,0.1501597724441619,0.19680851367384444,3,1.013154448568042,14753436.357245445,-0.19028338413590418,20日新高
MRVI,5.76,"Maravai LifeSciences Holdings, Inc., a life sciences company, provides products that enable the development of drug therapies, vaccines, drug therapies, cell and gene therapies, and diagnostics North America, Europe, the...",2124716288.0,0.07262576380523522,0.14970059196332408,0.31506851104661826,3,1.0858262947134636,14705872.09025383,0.0,20日新高
IMMX,10.04,"Immix Biopharma, Inc., a clinical-stage biopharmaceutical company, engages in the development of chimeric antigen receptor cell therapy in light chain Amyloidosis and immune-mediated diseases in the United States and Aus...",714747136.0,0.013118074313075434,0.14874144448273197,0.13574658241536786,3,1.080475337671958,15331089.63732481,-0.09712229629683633,20日新高
SRRK,52.33,"Scholar Rock Holding Corporation, a biopharmaceutical company, focuses on improving the lives of children and adults with spinal muscular atrophy (SMA) and other rare, severe, and debilitating neuromuscular diseases. The...",6270617088.0,0.020674885192643044,0.1485952645675841,0.01591930763427518,5,1.7789376236299004,65591463.98061752,0.0,连续5天上涨 / 20日新高
AUPH,18.62,"Aurinia Pharmaceuticals Inc., a biopharmaceutical company, engages in delivering therapies to people living with autoimmune diseases with high unmet medical needs in the United States and Japan. The company offers LUPKYN...",2394563328.0,0.04138712042506998,0.14796557506034547,0.2258065407243115,4,2.7762161228075226,22453856.536240578,0.0,20日新高
KSS,18.91,,,0.07872213957286922,0.1446730825316196,0.4340429428072903,1,0.897497815130262,100899349.25126553,-0.21686124767766646,20日新高
ALKS,50.45,"Alkermes plc, a biopharmaceutical company, engages in the research, development, and commercialization of pharmaceutical products to address unmet medical needs of patients in therapeutic areas in the United States, Irel...",8408794624.0,0.049511152136984427,0.14425041025948504,0.3507363540562132,5,1.5497164366895777,104333442.72827148,0.0,连续5天上涨 / 20日新高
COUR,6.09,"Coursera, Inc. operates an online learning platform that provides education and skills training in the United States, Europe, the Middle East, Africa, the Asia Pacific, and internationally. It operates through Consumer a...",1743924096.0,0.12569322076803036,0.14258916318208747,0.15122877060563011,2,2.514989135429457,39367843.585784435,-0.5204724217283057,放量大涨 / 20日新高
KBH,61.51,,,0.16650860715946258,0.14245910377429016,0.2496951807400729,2,3.4844526233000663,68369043.39832306,-0.08299789398304269,放量大涨 / 20日新高
KYMR,99.87,"Kymera Therapeutics, Inc., a clinical-stage biopharmaceutical company, focuses on discovering and developing small molecule therapeutics that selectively degrade disease-causing proteins by harnessing the body's own natu...",8215065088.0,0.01648857757335409,0.14215461983209754,0.23647402373830895,1,1.3952585562696158,68866025.14778137,0.0,20日新高
ULCC,7.43,"Frontier Group Holdings, Inc., provides low-fare passenger airline services to leisure travelers in the United States and Latin America. The company sells its products through direct distribution channels, such as websit...",1707334656.0,0.024827562529465164,0.1413209780508422,0.3992466870817628,2,0.8292688789563952,28546018.60291004,0.0,20日新高
